"""Imagine yourself as someone who used to neglect their health check-ups, but now you are committed to taking charge of your well-being."""
"""Picture yourself as the person who used to put off health check-ups, but now you prioritize your health and make appointments regularly."""
"""Visualize yourself as someone who used to avoid health check-ups, but now you embrace them as an essential part of your self-care routine."""
"""Envision yourself as the person who used to neglect their health check-ups, but now you are determined to be proactive and schedule regular appointments."""
"""Create a new self-identity as someone who used to ignore health check-ups, but now you are dedicated to being proactive and taking care of your health."""
"""Imagine yourself as the person who used to postpone health check-ups, but now you are committed to scheduling appointments promptly and prioritizing your well-being."""
"""Picture yourself as someone who used to overlook health check-ups, but now you value them as an important aspect of maintaining your overall health."""
"""Visualize yourself as the person who used to neglect health check-ups, but now you see them as an opportunity to stay on top of your health and prevent potential issues."""
"""Envision yourself as someone who used to avoid health check-ups, but now you embrace them as a proactive measure to ensure your well-being."""
"""Create a new self-identity as the person who used to disregard health check-ups, but now you are determined to prioritize your health and schedule regular appointments."""
