"""Remember, you don't have to go through this alone. Reach out to your friends, family, or colleagues for emotional support as you schedule your health check-up appointment."""
"""Having someone by your side can make all the difference. Seek emotional social support from your loved ones as you take the important step of scheduling your health check-up appointment."""
"""Don't hesitate to lean on your support system. They can provide the encouragement and reassurance you need to prioritize your health and book that check-up appointment."""
"""Surround yourself with people who care about your well-being. Seek emotional support from your friends, relatives, or colleagues as you make the decision to schedule your health check-up appointment."""
"""Remember, you're not alone in this journey. Seek emotional social support from your 'buddies' or staff members to help you stay motivated and committed to scheduling your health check-up appointment."""
"""Having someone to talk to can make the process easier. Reach out to your friends, family, or colleagues for emotional support as you take the first step towards scheduling your health check-up appointment."""
"""Don't underestimate the power of emotional support. Seek advice and encouragement from your loved ones as you prioritize your health and make that important health check-up appointment."""
"""Surround yourself with a strong support network. Seek emotional social support from your friends, relatives, or colleagues as you make the decision to schedule your health check-up appointment."""
"""Remember, you don't have to face this alone. Seek emotional support from your 'buddies' or staff members to help you stay motivated and accountable in scheduling your health check-up appointment."""
"""Having someone to lean on can make all the difference. Reach out to your friends, family, or colleagues for emotional support as you take the important step of scheduling your health check-up appointment."""
