"""Have you ever considered that your recent lack of energy could be due to external factors, such as stress or a change in your routine?"""
"""It's possible that your recent weight gain could be a result of internal factors, such as hormonal changes. However, it's important to rule out any underlying health issues."""
"""Instead of attributing your frequent headaches to just being tired, it might be worth considering other possibilities, such as dehydration or even an underlying medical condition."""
"""Sometimes, our bodies go through temporary changes that can affect our overall well-being. By scheduling a health check-up, you can gain a better understanding of what might be causing these changes."""
"""Rather than assuming that your recent mood swings are solely due to external circumstances, it's important to explore the possibility of any underlying physiological factors."""
"""By considering alternative explanations for your recent sleep disturbances, such as an undiagnosed sleep disorder, you can take proactive steps towards improving your overall sleep quality."""
"""It's easy to attribute your lack of appetite to stress or a busy schedule, but it's important to rule out any underlying medical conditions that could be affecting your appetite."""
"""Instead of assuming that your recent memory lapses are just a normal part of aging, it's worth considering the possibility of other factors, such as medication side effects or nutritional deficiencies."""
"""By exploring alternative explanations for your recent digestive issues, such as food intolerances or gastrointestinal disorders, you can take control of your health and find appropriate solutions."""
"""Rather than attributing your recent skin changes solely to external factors, it's important to consider other possibilities, such as hormonal imbalances or even allergies. A health check-up can help identify the root cause."""
