"""Remember, after missing your health check-up appointment, overcorrect by scheduling it immediately and making a note to prioritize your health."""
"""If you forget to schedule your health check-up appointment, overcorrect by setting multiple reminders and taking immediate action to book it."""
"""In order to reinforce the importance of your health, overcorrect by scheduling your check-up appointment with enthusiasm and commitment."""
"""After any delay in scheduling your health check-up appointment, overcorrect by making it a top priority and taking immediate action to secure a date."""
"""If you find yourself procrastinating on scheduling your health check-up appointment, overcorrect by setting a specific time and date right away."""
"""Remember, after any hesitation in booking your health check-up appointment, overcorrect by immediately calling your healthcare provider and scheduling it."""
"""If you've been putting off scheduling your health check-up appointment, overcorrect by making it a priority and taking immediate action to get it on the calendar."""
"""In order to reinforce the importance of regular check-ups, overcorrect by scheduling your health appointment promptly and with a sense of urgency."""
"""After any resistance to scheduling your health check-up appointment, overcorrect by making a commitment to your well-being and booking it without delay."""
"""If you've been neglecting to schedule your health check-up appointment, overcorrect by taking immediate action and making it a priority for your overall health."""
